{
  "candidate_manifest_sha256": "0177bec519a803e52652368572ec06b5bcdd3fdc3591c06e2e25b14cf5ff725e",
  "kind": "historical_public_replay_unavailability_reviews",
  "reviews": [
    {
      "candidate_sha256": "458dbabd58dd4f2dbc82269b697377f061b91e0829c0c9d469afa899e4f1899d",
      "decision": "permanently_unavailable",
      "rationale_code": "accepted_immutable_source_ref_unavailable_without_archive",
      "reason_code": "source_ref_permanently_unavailable",
      "request_id": "prr_037a769a544dfb38b9d572fe11a7ad85bd8ab3e9cef0dafd6cadfe805b46dc68"
    },
    {
      "candidate_sha256": "9715c4ddd6236c8114e17b5d451892001c790fbf24d7bfcc193ab96ab9ebab8f",
      "decision": "permanently_unavailable",
      "rationale_code": "accepted_immutable_source_ref_unavailable_without_archive",
      "reason_code": "source_ref_permanently_unavailable",
      "request_id": "prr_039758985fec29da9109a5ec7efb7d99c47ffc9fec749ba9891be7141e55678c"
    },
    {
      "candidate_sha256": "7f23454b49c5cf07ac2e8a101ac9c408c5615b574790a1d882f282857a9ac901",
      "decision": "permanently_unavailable",
      "rationale_code": "accepted_immutable_source_ref_unavailable_without_archive",
      "reason_code": "source_ref_permanently_unavailable",
      "request_id": "prr_0464a6555822320397103a58b6b4e3815c89d942fd2233fb2043def5a0a76aec"
    },
    {
      "candidate_sha256": "1ee8b5ff8e850a4caaea7afd66c140178195441c145c434e87e46617776353ba",
      "decision": "permanently_unavailable",
      "rationale_code": "accepted_immutable_source_ref_unavailable_without_archive",
      "reason_code": "source_ref_permanently_unavailable",
      "request_id": "prr_05f4f2d541029c238c47f02f6fca5ed37ea00613967d02294d70b8628e11f9c7"
    },
    {
      "candidate_sha256": "4da46779c666c66b6f3d2dd9acd5c19839e1e021fc091834c9ee1f0f08b5f41c",
      "decision": "permanently_unavailable",
      "rationale_code": "accepted_immutable_source_ref_unavailable_without_archive",
      "reason_code": "source_ref_permanently_unavailable",
      "request_id": "prr_0618c35cc115813d14bd89b6f45a9ce916ea90ee57cfce90671796a0e07fa6d8"
    },
    {
      "candidate_sha256": "5f69ecff938d47a1e3986cd12cb8fc5c0557626e300771376c29f3dde9cb6012",
      "decision": "permanently_unavailable",
      "rationale_code": "accepted_immutable_source_ref_unavailable_without_archive",
      "reason_code": "source_ref_permanently_unavailable",
      "request_id": "prr_085050701d1559dd1e22bbade09ff8145b92b56636c0b9e97da6cf1a69805111"
    },
    {
      "candidate_sha256": "8ee4212c010827f7110623f9d3a2925f2e143ecadbc478711d9c698d4e0634ac",
      "decision": "permanently_unavailable",
      "rationale_code": "accepted_immutable_source_ref_unavailable_without_archive",
      "reason_code": "source_ref_permanently_unavailable",
      "request_id": "prr_09a1ac18626fd6940658ecb1f3996c1e4e7faebedd2f83c57603d099ea2b666c"
    },
    {
      "candidate_sha256": "d030969990cc196e6681678d9a2fb63292237cf18500c5849541998bf7064ed9",
      "decision": "permanently_unavailable",
      "rationale_code": "accepted_immutable_source_ref_unavailable_without_archive",
      "reason_code": "source_ref_permanently_unavailable",
      "request_id": "prr_0aaa01551871dbb6ac2b9a19a7d0d7d0d6800d39044c9fb9bae33df5f840eee3"
    },
    {
      "candidate_sha256": "0f1422a6230e8ec3e038ae8b5d085c77bec272145097c7ce27470d6d93702ba5",
      "decision": "permanently_unavailable",
      "rationale_code": "accepted_immutable_source_ref_unavailable_without_archive",
      "reason_code": "source_ref_permanently_unavailable",
      "request_id": "prr_0b0599ff6cefc731eb0df13cd7abd640e445a13c24e7d697c3bbc4e97918e01e"
    },
    {
      "candidate_sha256": "66644651e05e1534ca052d5730383a3b74dea73af29c9b56ba064138e0afdeca",
      "decision": "permanently_unavailable",
      "rationale_code": "accepted_immutable_source_ref_unavailable_without_archive",
      "reason_code": "source_ref_permanently_unavailable",
      "request_id": "prr_0c802aca5195c88b27ec8347d95c78f7e74f1b830dc990f98d978966e72068c4"
    },
    {
      "candidate_sha256": "4ab077d4682235e0b383888ae890e2309f6f1222c8b9b3a3c5888b0c73bac7f2",
      "decision": "permanently_unavailable",
      "rationale_code": "accepted_immutable_source_ref_unavailable_without_archive",
      "reason_code": "source_ref_permanently_unavailable",
      "request_id": "prr_0ca1dc8cba584313d487f83f7b8b51d13e045f41aa7ebac300d6352ada1376f6"
    },
    {
      "candidate_sha256": "dab4199a6659ba8e013cfabc6d5e4d0504200519cbc5123261fd23e500a4b6db",
      "decision": "permanently_unavailable",
      "rationale_code": "accepted_immutable_source_ref_unavailable_without_archive",
      "reason_code": "source_ref_permanently_unavailable",
      "request_id": "prr_0ea240233c6952caad20d27f6bfa5dbbaeb301f1b751c3bba4820d9f9c77cfeb"
    },
    {
      "candidate_sha256": "0bd2e6ddaf0cb8178b90ab83cb24b7880bd48e7cc78f43f82f999b83378953ca",
      "decision": "permanently_unavailable",
      "rationale_code": "accepted_immutable_source_ref_unavailable_without_archive",
      "reason_code": "source_ref_permanently_unavailable",
      "request_id": "prr_10478dfe2f6de8317684164fe4cb569357eac5ff13834c660666053feffd5355"
    },
    {
      "candidate_sha256": "eeac266ed4a09084dd80ec287efe400faf04d5e6a9db58eb6cb6abb67f877ccd",
      "decision": "permanently_unavailable",
      "rationale_code": "accepted_immutable_source_ref_unavailable_without_archive",
      "reason_code": "source_ref_permanently_unavailable",
      "request_id": "prr_10b5946547a3f780cf453d72da24535cd065ee8298e419036d8136ffdbb942ef"
    },
    {
      "candidate_sha256": "2b5ce59d727e1799b0d289ba0b0bd41a5e59c2c75e35f942197e4681e9bb1380",
      "decision": "permanently_unavailable",
      "rationale_code": "accepted_immutable_source_ref_unavailable_without_archive",
      "reason_code": "source_ref_permanently_unavailable",
      "request_id": "prr_114da6e8116b41ca7fae086dd58270a9f8f9c03fd0d64919fe0b180a5f821a14"
    },
    {
      "candidate_sha256": "2e8cca30d3f0d0262b42ea544530a0db53af38e8e7bbf9d049ead8c41d8ea324",
      "decision": "permanently_unavailable",
      "rationale_code": "accepted_immutable_source_ref_unavailable_without_archive",
      "reason_code": "source_ref_permanently_unavailable",
      "request_id": "prr_12d881bf683afe16ff9016640647ef468f53021a1d4da5744cc5d6f1d11e80ee"
    },
    {
      "candidate_sha256": "2d90173e2d629b361f545a9ceb9df324516f32fc2c566220041f35ff009c009c",
      "decision": "permanently_unavailable",
      "rationale_code": "accepted_immutable_source_ref_unavailable_without_archive",
      "reason_code": "source_ref_permanently_unavailable",
      "request_id": "prr_131544f9bb49617c39883fda12ff10c756746160562a7cc033a165986b961376"
    },
    {
      "candidate_sha256": "1a2eb4cdf70a3f81d77418d68cdd4de65222d48a37af28db89f1399ae7d3fd39",
      "decision": "permanently_unavailable",
      "rationale_code": "accepted_immutable_source_ref_unavailable_without_archive",
      "reason_code": "source_ref_permanently_unavailable",
      "request_id": "prr_14c81dab47ff43e25b12e859709bd08fb0f7d5e69a3e6afd8739519af39d5196"
    },
    {
      "candidate_sha256": "7b369f75a41559d1949d55e2ca31b0e52e90ecd9fd118b4016452e5a3e0c4710",
      "decision": "permanently_unavailable",
      "rationale_code": "accepted_immutable_source_ref_unavailable_without_archive",
      "reason_code": "source_ref_permanently_unavailable",
      "request_id": "prr_1550fb4799a030ea82797f6182b0fc06403d020f6175cd61c07d576dcddfdb97"
    },
    {
      "candidate_sha256": "aa160dbada5683348468ed72d74dd387396cf8e62d1f8223e7d207134c610eee",
      "decision": "permanently_unavailable",
      "rationale_code": "accepted_immutable_source_ref_unavailable_without_archive",
      "reason_code": "source_ref_permanently_unavailable",
      "request_id": "prr_156706cdc71fe224bebe41f53ccec3ba2b8d89469b6e2c7832352ce555eb5184"
    },
    {
      "candidate_sha256": "645dfb356226605792a13602b869fd431a918cbac35e25f8ccdaa03f08d50263",
      "decision": "permanently_unavailable",
      "rationale_code": "accepted_immutable_source_ref_unavailable_without_archive",
      "reason_code": "source_ref_permanently_unavailable",
      "request_id": "prr_16fb96df11720fc339f54dc1ec4ea38feab2a3778e97ab83eb9a6edd1c997b6c"
    },
    {
      "candidate_sha256": "eb584abf7259f2db976b5db9621384ea35d414a61ad2e756409f214854206130",
      "decision": "permanently_unavailable",
      "rationale_code": "accepted_immutable_source_ref_unavailable_without_archive",
      "reason_code": "source_ref_permanently_unavailable",
      "request_id": "prr_17965d23766e95e363f1dad72da1b99b31011e26a78fb24ef041231dc56c4f76"
    },
    {
      "candidate_sha256": "058466593994950b8cf22f1aafa4ee784e9151e6c0f23a751c94371a449fe5a9",
      "decision": "permanently_unavailable",
      "rationale_code": "accepted_immutable_source_ref_unavailable_without_archive",
      "reason_code": "source_ref_permanently_unavailable",
      "request_id": "prr_18f786108aa0012a70b81bde212240ef4e4fd32b10e714916c4a71ff4334f226"
    },
    {
      "candidate_sha256": "cc3ca23233564f14ce853565947e07c3fad8f33640c7d9168a318d67e72e1f6e",
      "decision": "permanently_unavailable",
      "rationale_code": "accepted_immutable_source_ref_unavailable_without_archive",
      "reason_code": "source_ref_permanently_unavailable",
      "request_id": "prr_191671ebca01f2ce64fa02f8be3de228e93e437b0f382eb1bd8963ac56fe062a"
    },
    {
      "candidate_sha256": "3c2c0f4df2171e498c9e8781445a16ef547d3ea46d31c2c9fd30dc2c2b205e66",
      "decision": "permanently_unavailable",
      "rationale_code": "accepted_immutable_source_ref_unavailable_without_archive",
      "reason_code": "source_ref_permanently_unavailable",
      "request_id": "prr_19e8ea0ed6ca4c543c230fd025c3027f2daf906f54356a4a148f98f92574939f"
    },
    {
      "candidate_sha256": "5c05bd776205b8919e8e1ace282658c5966d16d573dd9bd512fb911e3b6e0987",
      "decision": "permanently_unavailable",